{
  "schema": "hideout.formal-inventory/v1",
  "tla2tools": {
    "version": "1.7.4",
    "sha256": "936a262061c914694dfd669a543be24573c45d5aa0ff20a8b96b23d01e050e88",
    "url": "https://github.com/tlaplus/tlaplus/releases/download/v1.7.4/tla2tools.jar"
  },
  "configurations": [
    {
      "id": "AttachReservation",
      "module": "formal/AttachReservation.tla",
      "config": "formal/AttachReservation.cfg",
      "kind": "safety"
    },
    {
      "id": "ConfigurationLifecycle",
      "module": "formal/ConfigurationLifecycle.tla",
      "config": "formal/ConfigurationLifecycle.cfg",
      "kind": "safety"
    },
    {
      "id": "DisposableRecovery",
      "module": "formal/DisposableRecovery.tla",
      "config": "formal/DisposableRecovery.cfg",
      "kind": "safety"
    },
    {
      "id": "MigrationAdoption",
      "module": "formal/MigrationAdoption.tla",
      "config": "formal/MigrationAdoption.cfg",
      "kind": "safety"
    },
    {
      "id": "MigrationAdoptionLiveness",
      "module": "formal/MigrationAdoption.tla",
      "config": "formal/cfg/MigrationAdoptionLiveness.cfg",
      "kind": "safety-liveness"
    },
    {
      "id": "MigrationBundle",
      "module": "formal/MigrationBundle.tla",
      "config": "formal/MigrationBundle.cfg",
      "kind": "safety"
    },
    {
      "id": "MigrationBundleLiveness",
      "module": "formal/MigrationBundle.tla",
      "config": "formal/cfg/MigrationBundleLiveness.cfg",
      "kind": "safety-liveness"
    },
    {
      "id": "NetworkTransition",
      "module": "formal/NetworkTransition.tla",
      "config": "formal/NetworkTransition.cfg",
      "kind": "safety"
    },
    {
      "id": "RequestWorkflow",
      "module": "formal/RequestWorkflow.tla",
      "config": "formal/RequestWorkflow.cfg",
      "kind": "safety"
    },
    {
      "id": "ResourceLifecycle",
      "module": "formal/ResourceLifecycle.tla",
      "config": "formal/ResourceLifecycle.cfg",
      "kind": "safety"
    },
    {
      "id": "StopObservation",
      "module": "formal/StopObservation.tla",
      "config": "formal/StopObservation.cfg",
      "kind": "safety"
    },
    {
      "id": "OperatorConfiguration",
      "module": "formal/OperatorConfiguration.tla",
      "config": "formal/cfg/OperatorConfiguration.cfg",
      "kind": "safety"
    },
    {
      "id": "OperatorConfigurationLiveness",
      "module": "formal/OperatorConfiguration.tla",
      "config": "formal/cfg/OperatorConfigurationLiveness.cfg",
      "kind": "safety-liveness"
    },
    {
      "id": "RequestWorkflowLiveness",
      "module": "formal/RequestWorkflow.tla",
      "config": "formal/cfg/RequestWorkflowLiveness.cfg",
      "kind": "safety-liveness"
    },
    {
      "id": "SecretTransition",
      "module": "formal/SecretTransition.tla",
      "config": "formal/cfg/SecretTransition.cfg",
      "kind": "safety-liveness"
    },
    {
      "id": "WorkloadObservation",
      "module": "formal/WorkloadObservation.tla",
      "config": "formal/cfg/WorkloadObservation.cfg",
      "kind": "safety"
    },
    {
      "id": "WorkloadObservationLiveness",
      "module": "formal/WorkloadObservation.tla",
      "config": "formal/cfg/WorkloadObservationLiveness.cfg",
      "kind": "safety-liveness"
    }
  ],
  "goRefinement": {
    "packages": [
      {
        "path": "./internal/manager",
        "importPath": "github.com/vibe-agi/hideout/internal/manager"
      },
      {
        "path": "./internal/daemon",
        "importPath": "github.com/vibe-agi/hideout/internal/daemon"
      },
      {
        "path": "./internal/migration",
        "importPath": "github.com/vibe-agi/hideout/internal/migration"
      },
      {
        "path": "./internal/backend/lima",
        "importPath": "github.com/vibe-agi/hideout/internal/backend/lima"
      }
    ],
    "tests": [
      {
        "package": "github.com/vibe-agi/hideout/internal/manager",
        "name": "TestFormalFoundationConfigurationsMatchSharedConstantsAndInvariants",
        "source": "internal/manager/formal_refinement_test.go",
        "classification": "refinement"
      },
      {
        "package": "github.com/vibe-agi/hideout/internal/manager",
        "name": "TestOperatorConfigurationProductionTraceRefinesFoundationModel",
        "source": "internal/manager/formal_refinement_test.go",
        "classification": "refinement"
      },
      {
        "package": "github.com/vibe-agi/hideout/internal/manager",
        "name": "TestWorkloadObservationProductionTypesRefineFoundationModel",
        "source": "internal/manager/formal_refinement_test.go",
        "classification": "refinement"
      },
      {
        "package": "github.com/vibe-agi/hideout/internal/manager",
        "name": "TestFormalGoFixturesConformToPublishedSchemas",
        "source": "internal/manager/formal_refinement_test.go",
        "classification": "refinement"
      },
      {
        "package": "github.com/vibe-agi/hideout/internal/manager",
        "name": "TestProfileTransactionTraceRefinesOperatorConfigurationModel",
        "source": "internal/manager/profile_transaction_refinement_test.go",
        "classification": "refinement"
      },
      {
        "package": "github.com/vibe-agi/hideout/internal/manager",
        "name": "TestSecretAndRouteTraceRefinesSecretTransitionModel",
        "source": "internal/manager/profile_transaction_refinement_test.go",
        "classification": "refinement"
      },
      {
        "package": "github.com/vibe-agi/hideout/internal/manager",
        "name": "TestSecretAuthorityResetRecoveryTraceRefinesSecretTransitionModel",
        "source": "internal/manager/profile_transaction_refinement_test.go",
        "classification": "refinement"
      },
      {
        "package": "github.com/vibe-agi/hideout/internal/manager",
        "name": "TestFormalReleaseGateEnumeratesEveryTLAConfiguration",
        "source": "internal/manager/profile_transaction_refinement_test.go",
        "classification": "refinement"
      },
      {
        "package": "github.com/vibe-agi/hideout/internal/manager",
        "name": "TestOperationRecoveryTraceRefinesOperatorConfigurationModel",
        "source": "internal/manager/operation_recovery_refinement_test.go",
        "classification": "refinement"
      },
      {
        "package": "github.com/vibe-agi/hideout/internal/manager",
        "name": "TestOperationRollbackTraceRefinesOperatorConfigurationModel",
        "source": "internal/manager/operation_recovery_refinement_test.go",
        "classification": "refinement"
      },
      {
        "package": "github.com/vibe-agi/hideout/internal/manager",
        "name": "TestOperationRecoveryRefinementMutationJudge",
        "source": "internal/manager/operation_recovery_refinement_test.go",
        "classification": "refinement"
      },
      {
        "package": "github.com/vibe-agi/hideout/internal/manager",
        "name": "TestOperationRecoveryCrashMatrix",
        "source": "internal/manager/operation_recovery_test.go",
        "classification": "crash-matrix"
      },
      {
        "package": "github.com/vibe-agi/hideout/internal/migration",
        "name": "TestBundleTransitionTraceRefinesMigrationBundle",
        "source": "internal/migration/state_refinement_test.go",
        "classification": "refinement"
      },
      {
        "package": "github.com/vibe-agi/hideout/internal/migration",
        "name": "TestBundleCancellationNeverPublishes",
        "source": "internal/migration/state_refinement_test.go",
        "classification": "refinement"
      },
      {
        "package": "github.com/vibe-agi/hideout/internal/migration",
        "name": "TestAdoptionTraceRefinesIndependentMultiDestinationImports",
        "source": "internal/migration/state_refinement_test.go",
        "classification": "refinement"
      },
      {
        "package": "github.com/vibe-agi/hideout/internal/migration",
        "name": "TestAdoptionConflictRollbackAndInvalidBundleStayNonRunnable",
        "source": "internal/migration/state_refinement_test.go",
        "classification": "refinement"
      },
      {
        "package": "github.com/vibe-agi/hideout/internal/migration",
        "name": "TestAdoptionReplacementRequiresIndependentConfirmationAndFreshReplan",
        "source": "internal/migration/state_refinement_test.go",
        "classification": "refinement"
      },
      {
        "package": "github.com/vibe-agi/hideout/internal/migration",
        "name": "TestAdoptionRenameAndRefusalNeverDeleteExistingOwner",
        "source": "internal/migration/state_refinement_test.go",
        "classification": "refinement"
      },
      {
        "package": "github.com/vibe-agi/hideout/internal/migration",
        "name": "TestStateInvariantNegativeFixtures",
        "source": "internal/migration/state_refinement_test.go",
        "classification": "refinement"
      },
      {
        "package": "github.com/vibe-agi/hideout/internal/manager",
        "name": "TestMigrationImportMaterializationResumesProviderCheckpointWithoutRecountingCapacity",
        "source": "internal/manager/migration_materialize_test.go",
        "classification": "crash-matrix"
      },
      {
        "package": "github.com/vibe-agi/hideout/internal/manager",
        "name": "TestMigrationImportRollbackResumesFromProviderFailureWithoutRepeatingLocalWork",
        "source": "internal/manager/migration_import_verify_test.go",
        "classification": "crash-matrix"
      },
      {
        "package": "github.com/vibe-agi/hideout/internal/manager",
        "name": "TestMigrationImportCommitRaceAfterDecisionRequiresFinish",
        "source": "internal/manager/migration_import_commit_test.go",
        "classification": "crash-matrix"
      },
      {
        "package": "github.com/vibe-agi/hideout/internal/manager",
        "name": "TestMigrationImportCommitResumesSameOneWayDecision",
        "source": "internal/manager/migration_import_commit_test.go",